<?xml version="1.0"?>

<repository
xmlns="http://www.geeklog.com"
xmlns:xsi="http://www.w3.org/2001/XMLSchema-instance"
xsi:schemaLocation="http://www.geeklog.com patch_listing.xsd">

<!-- Start patch List -->
    <patch>
        <id>1</id>
	<name></name>
	<plugin_id></plugin_id>
	<applies_num></applies_num>
	<version></version>
	<severity></severity>
	<automatic_install></automatic_install>
	<ext></ext>
	<description></description>
    </patch>


<!-- End patch List -->

</repository>